{
  "version": "1",
  "command_id": "cmd-v2-live-theme-navigation-temp-change-20261022-01",
  "tenant": "eduardo-research",
  "action": "navigation.update",
  "requested_by": "chatgpt",
  "payload": {
    "location": "primary",
    "items": [
      "about",
      "research",
      "cv",
      "contact",
      "insights"
    ]
  }
}
